Review, Rating, Date,Subjectivity,Polarity
I live by Google. And Google connected to HubSpot is even better - I certainly can track sale conversions much easier,5,Aug 31 2021,0.44285714285714284,0.26266233766233765
Everything is fine with Gmail. Except for the supports. but your CRM has lost the desire to use. I'm afraid that something else will break.,1,Aug 30 2021,0.7,-0.09166666666666665
stuggling with how to organize and effectively communicate with GMAIL. Not a fan.,2,Aug 30 2021,0.8,0.6
excelente todo muchas gracias por tan excelente integración me ha servido mucho,5,Aug 30 2021,0.0,0.0
Integration make communication with clients and work tasks so much easier. Highly recommend.,5,Aug 28 2021,0.37,0.18
We use Google Business Suite to host our email. This is my third attempt at using a CRM and HubSpot is by far the best. It's easy to set up including its integration with Gmail. It's so convenient that I'd rather access email in HubSpot than in Outlook or Gmail.,5,Aug 28 2021,0.5333333333333333,0.38333333333333336
Muito bom. Iremos iniciar com HubSpot em alguns dias. Porem é uma ferramenta bem completa.,4,Aug 27 2021,0.0,0.0
The connectivity with HubSpot is simple and provides great automation and time saving.,5,Aug 27 2021,0.5535714285714286,0.4
I love Gmail as I manage 4 accounts and it makes easy to keep up with them all.,2,Aug 27 2021,0.7166666666666667,0.4666666666666667
Never been able to make it function. Using web based and email client based. Just doesn't function.,1,Aug 26 2021,0.625,0.5
Works as expected not s useful as YesWare because you have to go to HubSpot for the activity summary.,4,Aug 26 2021,0.2,-0.125
Install configure and off you go. Easy for those of us who use gmail natively.,5,Aug 26 2021,0.8333333333333334,0.43333333333333335
I'm very satisfied. Can't say much as it works out of the box. The setup is literally a couple of clicks especially if you're already logged in both HubSpot and Gmail.,5,Aug 26 2021,0.7333333333333334,0.2833333333333334
I use google for Email and task management but HubSpot keeps on crashing. It also logs every single email automatically I would actually prefer to choose which one to log.,1,Aug 26 2021,0.15714285714285714,-0.03571428571428571
Gmail works great as long as it is not integrated with HubSpot. Once it was integrated my emails were blocked by the firewalls of my largest clients and the only way to get my emails through was to lose the integration then have their IT team allow access for every individual that I'd contacted during the time my Gmail was integrated with HubSpot.,1,Aug 25 2021,0.6375,0.1875
Es una herramienta indispensable para las empresas como apoyo a las estrategias digitales,5,Aug 25 2021,0.9,0.4
quiero la conexion de HubSpot solamente con uno de los dos emails pero no puedo desconectar el que no quiero...,2,Aug 25 2021,0.0,0.0
I just integrated Hub and Gmail - Gmail could be simpler and smarter to use.,4,Aug 25 2021,0.0,0.0
Gamil and HubSpot are the best combination i believe because it saves our time by being on same platform and dual work happening.,5,Aug 25 2021,0.2125,0.5
Excelente muchas funciones integradas fáciles de usar ayudándote a ser más productivo,5,Aug 25 2021,0.0,0.0
está funcionando muito bem é essencial na minha atividade troco muitos e-mail com clientes no dia a dia.,5,Aug 24 2021,0.0,0.0
Not every single email I send needs to be logged in HubSpot this needs to be more intuitive.,2,Aug 24 2021,0.35714285714285715,0.2142857142857143
ha funcionado muy bien y tenemos todo en un solo lugar. podemos revisar toda la informacion en HubSpot,5,Aug 24 2021,0.0,0.0
G-Mail molto efficiente robusto il miglior software per la gestione della posta elettronica ma non solo...,5,Aug 24 2021,0.0,0.0
Funciona bien y nos permite manejar mejor la información a nivel de áreas para entregar una atención más rápida y personalizada,5,Aug 23 2021,0.0,0.0
O Google Mail é bom e barato. Atende as necessidades da empresa no momento.,2,Aug 23 2021,0.0,0.0
it is working ok however sometimes we have difficulties with the syncro between HubSpot and gmail this caused problems with meeting scheduling..which is pretty important for us,2,Aug 23 2021,0.8333333333333334,0.3833333333333333
Permet de résoudre les problèmes à tempsréduire le coût sur tous les plans.,4,Aug 21 2021,0.0,0.0
aaaaaaaaaaaaaaaaaaaaaaaaaaaaaaaaaaaaaaaaaaaaaaaaaaaaaaaaaaaaaaaaaaaaaaaaaaaaaaaaaaaaaaaaaaaaaaaaaaaaaaaaaaaaaaaaaaaaaaaaaaaaaaaa,3,Aug 19 2021,0.0,0.0
Es muy funcional ya que podemos estar conectados todos los miembros de mi empresa sin necesidad de tener una red física y super bien para estar conectados en estos tiempos de trabajo a distancia,5,Aug 19 2021,0.3333333333333333,0.16666666666666666
It has made follow up with clients seamless and easy to remember everything!,5,Aug 18 2021,0.4666666666666667,0.32083333333333336
It's good. I like that it shows when emails were opened and that it creates new contacts automatically. Easy to keep track of what was said and when.,4,Aug 18 2021,0.6292929292929293,0.4232323232323232
When I connected Gmail it seems I lost tracking of emails. Now it says 170 emails sent and zero opened. That seems near impossible,3,Aug 18 2021,0.7,-0.2833333333333333
Gmail is a great format especially for low to medium revenue companies that do not have a lot of resources,5,Aug 18 2021,0.6833333333333332,0.26666666666666666
Great we use it for everything. It makes everything so simple being able to sync calendars and send invites via gmail is very helpful.,5,Aug 18 2021,0.5080357142857143,0.375
Lo uso desde siempre es la mejor herramienta de correo y para mí poder unificarlo con el CRM es imprescindible,5,Aug 18 2021,0.0,0.0
Gmail is the standard that all email platforms should strive for. Easy to use and straightforward. All features needed.,5,Aug 17 2021,0.40277777777777785,0.26944444444444443
En general bien. Funciona de maravilla se integra facil con todas las aristas de un negocio u empresa.,5,Aug 17 2021,0.5,0.05000000000000002
It made my work much easier and faster. It log and track every email I send or receive :),5,Aug 17 2021,0.6,0.35
Very well. I can't write 75 characters worth of stuff to fill up a whole review.,5,Aug 17 2021,0.26666666666666666,0.2333333333333333
do not like it at all this is horrible to work with. Do not like to work on gmail at all.,1,Aug 17 2021,1.0,-1.0
Gmail es excelente pero no se vincula bien con HubSpot y eso es lo que necesito. poder ver si abrieron mi mail,1,Aug 16 2021,0.0,0.0
Funciona bien se integra perfecto solo algunas veces falla la conexión con otras apps,3,Aug 16 2021,0.0,0.0
I dunno why HubSpot is so terrible when it comes to email deliverability please note.,1,Aug 16 2021,1.0,-1.0
me ayuda mucho tiene excelentes apps  es una excelente herramienta de trabajo.,5,Aug 16 2021,0.0,0.0
Creo que podría ser más atractiva y debería ofrecer información más relevante o útil para realizar acciones dentro de Gmail.,2,Aug 13 2021,0.0,0.0
Todo bien con la herramienta hasta el momento. Satisfecho en general._________,5,Aug 12 2021,0.5,0.05000000000000002
Me ha funcionado para lo que quiero sin embargo aún no tengo la disponibilidad para hacer el seguimiento de clics a enlaces que pongo en los correos desde gmail,3,Aug 12 2021,0.0,0.0
It works okay I like the tracking and seeing how many times someone opens or interacts with the emails. Not crazy about them automatically being added to the database. Maybe I want to wait until they respond or sign up to the product for real. thanks,3,Aug 12 2021,0.55,0.4
,5,Aug 12 2021,0.0,0.0
Features like template and document helps me save time and storage space. I also like how i can schedule meetings via zoom and link it to my Google calendar.,5,Aug 12 2021,0.0,0.0
Con una mayor interacción entre los usuarios internos y externos en la empresa sin duda mejora la aplicación de procesos,4,Aug 11 2021,0.0,0.0
Without it the process would be very manual. I love how you can pop into the CRM quickly in the sidebar.,5,Aug 11 2021,0.4666666666666666,0.3444444444444444
This Gmail integration enables me to be perfectly personal as well as keep track of the data that matters to my company.,5,Aug 11 2021,0.3,0.0
Funciona muy bien el acceso web desde cualquier ubicación lo valoro mucho así como la integración con toda la solución de Workspace (Calendario Drive Meet entre otros).,5,Aug 11 2021,0.0,0.0
Excellent no problem found in using the gmail plus the HubSpot just only wondering to upgrade my permission to be super user so that I can use all of the function  ahaha,5,Aug 10 2021,0.8888888888888888,0.4444444444444444
Gmail is a great email and the automation by HubSpot speed up processes. You must integrate the email with the CRM,4,Aug 9 2021,0.75,0.8
Es un correo que usualmente usan las compañías al no tener correos corporativos y es fácil de usar.,5,Aug 9 2021,0.0,0.0
Es muy amigable fácil de usar tiene muchísima integrabilidad con otras aplicaciones en este caso con HubSpot lo que mas me gusta son las notificaciones cuando alguien abre los correos que le envío.,5,Aug 9 2021,0.0,0.0
Using it for both personal and work Gmail has been my main email provider for many years. The easy capability of switching between personal and work emails across all my devices and seamless integrations and functionalities (calendar Gmeets etc) keep me organised and would find it difficult to switch to another provider.,5,Aug 9 2021,0.48095238095238096,0.10000000000000002
Whenever I am making a Task in HubSpot by selecting a particular time and date I am not receiving a update on Gmail about it or Notification,2,Aug 6 2021,0.3333333333333333,0.16666666666666666
I love it and the integration is one of the best IT applications I am using at the moment.,4,Aug 6 2021,0.44999999999999996,0.75
Bien solo falta que puedas incluir tu firma y que no alenté Gmail que toda tu información quede dentro del cliente y contacto con quien tienes la comunicación me encanta,5,Aug 6 2021,0.0,0.0
Gmail werkt prima ik gebruik daarvoor een mailapp. Maar dat je het alleen kan koppelen met HubSpot als je in de browser gmail gebruikt is echt heel karig.,1,Aug 6 2021,0.0,0.0
It works when I send the emails it’s very straight forward. Dont know why I have to write 75 characters min.,5,Aug 6 2021,0.52,0.26
HS defaults to tracking your email engagement so I kept unchecking boxes to send an email. After a few occurrences of pop up messages I removed the app.,2,Aug 5 2021,0.1,-0.2
After integrating with HubSpot my Outlook constantly crashes. It freezes at times and also restarts automatically whilst typing an email. In addition at random sometimes my emails continue to reload for no reason eventually crashing my Outlook.,1,Aug 5 2021,0.41666666666666663,-0.25
Need to bind an existing E-Mail conversation that runs over a contact to a a ticket.,3,Aug 4 2021,0.0,0.0
Amazing it's absolutely crucial for daily operations and managing everything,3,Aug 4 2021,0.6333333333333333,0.20000000000000004
aaaaaaaaaaaaaaaaaaaaaaaaa aaaaaaaaaaaaaaaaaaaaaaaaa aaaaaaaaaaaaaaaaaaaaaaaaa,2,Aug 4 2021,0.0,0.0
Todo bien me ha gustado mucho la dinámica para dar un buen seguimiento a mis prospectos,5,Aug 3 2021,0.0,0.0
It works great 90% of the time. There are times that the email that comes into gmail does not show up in our conversations inbox.,4,Aug 3 2021,0.75,0.8
excelente me ayuda con mandar plantillas y me avisa cuando el cliente ve los correos.,5,Aug 2 2021,0.0,0.0
Gmail funktioniert ganz wunderbar mit HubSpot - das ist alles was mir dazu einfällt,5,Jul 30 2021,0.0,0.0
Chrome Sales Extension works fine. But just that (not marking emails as read on the HubSpot Inbox) is unacceptable. We wanted to request all the sales reps to only work with the HubSpot Inbox to organize the follow up of leads but it turns out,5,Jul 29 2021,0.75,0.20833333333333334
Good it's very helpful. I am able to reschedule and follow up better. I'm getting ready to really grow my business,5,Jul 29 2021,0.4541666666666668,0.38333333333333336
"The app is pretty good for basic stuff but I'd would really prefer to be able to quickly set and run my tasks in gmail. 1) Hotkeys to create and then quickly set due date. Also navigating the tasks next skip complete... 2) Support for worlds like ""next tuesday"" or ""1 week"" or ""1 month"" etc 3) Ability to see context on tasks rather than having to click on them contact company etc. would be really helpful.",3,Jul 29 2021,0.3770833333333334,0.2076388888888889
The integration works great! It's easy for users to choose to log and track emails. My only complaint is that you can't sync past emails so users have to remember to Log and/or Track emails while they compose their email.,4,Jul 28 2021,0.6066666666666667,0.17666666666666667
It's been great connecting all of the employees from all over the world. It's very user-friendly and it integrates with our sales tools well (HubSpot included).,5,Jul 28 2021,0.525,0.5
Es hoy uno de los canales de comunicación con Leads y Clientes y es muy efectivo.,5,Jul 28 2021,0.0,0.0
Gmail est fiable en termes d'utilisation et avec HubSpot on a un retour sur l'ouverture des mail et l'ouverture des liens .,5,Jul 28 2021,0.0,0.0
複数の人に同じ内容を一斉に共有できる。 Ｈｕｂｓｐｏｔの利便性が余り感じられない。　 確認していただいたことが分かるが、返事がないため今までと変わらない気がする。,3,Jul 28 2021,0.0,0.0
Excelente muy práctica de integra con muchas aplicaciones y me hace tener todo bajo control en un mismo lugar,5,Jul 28 2021,0.0,0.0
Google suit is very helpful and integrated. I believe Gmail make things easier by login in different platforms.,4,Jul 27 2021,0.44999999999999996,0.1
Gmail HubSpot integration is awesome and i love how seamless the experience is.,5,Jul 27 2021,0.5666666666666668,0.5333333333333333
Moving from classic mailbox to full Google Workspace changed our way of working. No return hopefully,5,Jul 27 2021,0.35833333333333334,0.2583333333333333
Am not Satisfaction. compare to other CRM its very commercial on free version no such advantages.,1,Jul 27 2021,0.41875,0.06875
Everything is good except the situations when mail sent in Gmail is not saved in HubSpot. It happened like with 5 % of sent emails.,3,Jul 27 2021,0.6000000000000001,0.7
It's needed to communicate with clients. There's also a need of google drive in order to maintain the client databases.,3,Jul 27 2021,0.0,0.0
Facile pour garder une trace de tous les échanges avec prestataires clients etc.,5,Jul 26 2021,0.0,0.0
It has increased the performance by faster and accurate database and quick responce,5,Jul 26 2021,0.5666666666666667,0.3666666666666667
Muita agilidade para realização do controle de todo o CRM da empresa diversas ferramentas importantes,5,Jul 24 2021,0.0,0.0
HubSpot tasks has never worked in my Gmail. Additionally creating contacts and leads is not an instant thing; each contact or lead takes about 5 minutes to load into the HubSpot so I can't log certain emails right away.,2,Jul 23 2021,0.5912698412698413,0.16666666666666666
A integração funciona bem todas os agendamentos são registrados automaticamente e eu também consigo enviar e-mails por dentro do Hub que aparecem no Gmail.,5,Jul 23 2021,0.0,0.0
ik haal het uiterste er nog niet uit. kan er meer uit halen. kost me in begin veel tijd.,4,Jul 23 2021,0.0,0.0
I enjoy that I have access to all my working and emails at the same time and can access between various applications.,3,Jul 22 2021,0.375,0.13333333333333333
Gmail is alright on mobile HubSpot however isn't mobile friendly since I can't send images or files through the HubSpot app.,1,Jul 22 2021,0.5,0.375
"The best I can say is that it's minimally functional. Essentially consider it mostly a ""view only"" window into HubSpot which has clearly decided it wants you to ""live in"" the HubSpot web app all day rather than work out of Gmail. For context we migrated from Copper CRM to take advantage of HubSpot's complete suite--CRM sales hub marketing hub customer service hub etc. Copper can't match the functionality of having everything in one place. That said it's shocking to me that a vastly smaller company by comparison could be light years beyond HubSpot when it comes to Gmail integration. Our sales team has always worked out of the inbox. Copper allowed them to do that because there wasn't any day-to-day deal/opp management functionality that existed in the web app that didn't exist in the Chrome extension. This allowed our sales team to quickly and easily manage every aspect of a related contact company and deal/opp record without ever leaving Gmail. It was such a good experience that I simply presumed a company of HubSpot's size and cost would be at least as good if not better. I was wrong.",2,Jul 21 2021,0.5397186147186148,0.11150137741046832
essential tool for client ability to coordinate their schedule with mine. Ease of use from my clients who are appreciative.,3,Jul 21 2021,0.6,0.3
Funciona muy bien la integración en general con los correos de gmail en el navegador,5,Jul 21 2021,0.5,0.05000000000000002
HubSpot is a very very very slow platform. Probably the slowest CRM I have ever used.,1,Jul 21 2021,0.52,-0.39000000000000007
Muy bien es una herramienta muy util que me ha permitido comunucarme y poder trabajar en conjuntomcon otras app,5,Jul 21 2021,0.0,0.0
Es muy facil integrar los contacto de Gmail con la aplicación. FAcil acceso y seguimiento de correos,5,Jul 21 2021,0.0,0.0
NO FUNCIONA LA INTEGRACION TIPO IMAP CON HubSpot; SE HIZO POR CELULAR  SE HIZO POR COMPUTADORA Y NO SE SINCRONIZA.,1,Jul 21 2021,0.0,0.0
Gmail works fine but HubSpot integration with Gmail I think is terrible! i don't like it,3,Jul 20 2021,0.75,-0.29166666666666663
Gmail works extremely good for me and our organization. Helps us reduce all the distance between our offshore customer base.,5,Jul 20 2021,0.8,-0.050000000000000044
It's a great tool that can track when an email is opened and to register some conversations in HS that are important to have in the CRM,5,Jul 20 2021,0.875,0.6000000000000001
Esta impresión también puede ser aplicada destinada a ser acordada destinada por todos. En términos de valores aplicando una combinación de medios; de elementos de tamaño sectores y países distintos. Que califico de 'teal - integrales' y que retrata.,5,Jul 19 2021,0.0,0.0
Overall HubSpot and Gmail work together pretty well. No issues for me,5,Jul 19 2021,0.5,0.125
It works well but one thing that is very difficult is not being able to have the ability to organize my inbox using folders or segmentation. It crowds my inbox and makes my life a bit more difficult when I am seeing hundreds of emails daily.,3,Jul 16 2021,0.625,-0.030000000000000006
Gmail + HubSpot es un buen equipo porque te ayuda a dar seguimiento a los correos que envías a tus clientes y visualizar todas las acciones que realizan.,4,Jul 16 2021,0.0,0.0
Sim. Funciona bem acesso fácil. Somente o Maill track poderia ser ilimitado sem custo.,4,Jul 16 2021,0.0,0.0
At this point it appears to be performing well. So you're prompting me to say more...? This is very strange HubSpot. I gave you an honest reply.,4,Jul 16 2021,0.5316666666666667,0.345
So far so good. However not all features are available on the app vs. desktop,5,Jul 15 2021,0.6666666666666666,0.39999999999999997
After setup It's a complete breeze to use HubSpot. It's the only CRM I have ever used so my standards are high for any future positions I hold where I need to use a CRM.,5,Jul 15 2021,0.51625,0.065
Like I said I'm fairly new to this system so I'm still at the newbie stage. I will report later once I have got used to using the system.,4,Jul 15 2021,0.22727272727272727,0.06818181818181818
Ecosystème complet qui permet une synchronisation avec mon téléphone mobile,5,Jul 15 2021,0.0,0.0
Working very well all the features have helped our team gather leads in HubSpot through Gmail,5,Jul 15 2021,0.3,0.2
Funciona perfectamente en torno a cantidad de documentos que se pueden enviar orden y coordinación que puedo tener con mis clientes.,5,Jul 14 2021,0.0,0.0
Very useful to have all my business email connected to HS so I can track the record of all my communication and have my teammates aware of what's going on,5,Jul 14 2021,0.125,0.32
The integration works very well. There's one improvement I'd like to see. Currently it tracks every communication including ones with my coworkers. It would be nice to have a way to tell the tool to ignore certain domains (not just individual users).,5,Jul 13 2021,0.5342857142857143,0.20285714285714285
We really need inbound emails that we do not reply to to be able to be logged in HS. It seems odd that this is an issue!,3,Jul 13 2021,0.35833333333333334,0.1638888888888889
Overall the integration is great. There are some slight recommendations I would offer to HubSpot for improvement as I'm sure this is a popular integration.,3,Jul 13 2021,0.5411111111111111,0.3466666666666667
sehr gut bin sehr zufrieden. Funktioniert sehr genau. Zeitsparend.,5,Jul 13 2021,0.0,0.0
Excelente puedo usar mis contactos de celular para enviarles emails,5,Jul 13 2021,0.0,0.0
Love it! Integrates perfectly. Does what I need it to do. You don't have to switch back and forth between Google Workspace and HubSpot.,5,Jul 12 2021,0.5333333333333333,0.5416666666666666
HubSpot est le seul logiciel à s'intégrer parfaitement avec Gmail ou Outlook. Généralement les CRMs ne permettent pas de consigner et de suivre les emails en dehors de leur application. HubSpot est le seul logiciel à permettre le suivi et la consignation des emails depuis Gmail.,5,Jul 12 2021,0.0,0.0
It amazing,5,Jul 12 2021,0.9,0.6000000000000001
I love that I can see opens to know that the message got to my prospect. I also like how it is easy to create contacts and tasks right out of Gmail.,5,Jul 12 2021,0.6563492063492063,0.4063492063492064
Es muy bueno. Excelente. ¿Qué más querés que te diga? 👀 👀👀👀👀👀👀👀👀👀👀👀👀👀👀👀👀,5,Jul 11 2021,0.0,0.0
It helps to keep track to all my clients create tasks and so much more. Its my go to CRM!,5,Jul 10 2021,0.5,0.625
A little more difficult following up in HubSpot and seeing new emails outside of HubSpot.,2,Jul 10 2021,0.4340909090909091,-0.008522727272727274
All my line ups are sorted. Easy to track activity done on my leads. Its super easy.,5,Jul 10 2021,0.7777777777777778,0.39999999999999997
Me gusta gmail en general es una buena herramienta de comunicación y almacenamiento de información valiosa para mi organizacion,4,Jul 9 2021,0.5,0.05000000000000002
HubSpot is very straight forward and easy to use. It made handling employee concern better and faster. It streamlined our processes and made the team's response time more efficient.,5,Jul 9 2021,0.5883333333333334,0.42333333333333334
Gmail + HubSpot together have helped save me time and helped my business drastically. Every day I learn something new I am finding a way to save myself time every day. As a Realtor and someone who works 2 jobs every minute counts! Don't know how I went so long without this product.,5,Jul 9 2021,0.42727272727272725,0.06022727272727272
The two completely different HubSpot integrations for shared accounts vs individual accounts confuses the team and limits our ability to track all emails well. In addition any email sent from HubSpot appears to go directly to clients' Promotions folder which is about as bad as Spam..,3,Jul 8 2021,0.5166666666666666,-0.14999999999999997
Was apprehensive about using gmail over outlook however once you get used to it it's user friendly. Combined with GSuite its a great platform,5,Jul 8 2021,0.625,0.5875
This is better to friendly use. Work nicely as Gmail mentioned to us I really enjoyed to use this,5,Jul 8 2021,0.675,0.49375
It works as expected and provides good features and integrations to other G-Suite products.,5,Jul 7 2021,0.4583333333333333,0.15833333333333333
Muy bien esta bien integrado la usabilidad y la experiencia como usuario es fantastica.,5,Jul 7 2021,0.0,0.0
it does not work with HubSpot due to limitations. needs to run in chrome in stead of safari can only log 10 adresses at once while using a mailing list. very limited very inefficient.,2,Jul 7 2021,0.46517857142857144,-0.004464285714285712
Gmail has been the go-to of businesses globally and its nice that HubSpot created an integration between two platforms making it easy to keep track of daily business,5,Jul 7 2021,0.45833333333333337,0.2583333333333333
Is my company mail so we are using the platform to manage customer communication activities as well as to edit some documents,4,Jul 7 2021,0.0,0.0
Great but sometimes the integration of HubSpot and Gmail tend to glitch and not properly forward emails to HubSpot,3,Jul 6 2021,0.425,0.4
Gmail has via HubSpot is seamless and it has all the functionality that I needed plus the tracking if someone has opened and accessed the email sent.,5,Jul 6 2021,0.1,0.1
i dont feel the value is complicated to use other crm tools are winning HubSpot,2,Jul 6 2021,0.7083333333333334,-0.041666666666666664
Me permite tener un mejor historial de actividades teniendo visibilidad de actibidades,5,Jul 6 2021,0.0,0.0
Gmail and HubSpot are working hand in hand and its very keeping track of mails,5,Jul 5 2021,0.3,0.2
No sabría valorarla aún pues la configuración no es fácil. Sé que tiene mucho más potencial incluso la versión gratuita pero me falta conocer mejor la forma de configurarlo,2,Jul 4 2021,0.0,0.0
The UX and UI is good but the notifications are misleading at times. Giving false notification of open rates,3,Jul 2 2021,0.5666666666666668,0.09999999999999996
Has always been the best tool for companies everyone aligns easily to work targets,5,Jul 2 2021,0.5666666666666667,0.7166666666666667
